Name,Description,Latitude,Longitude,InfoURL,ImageURL
UCSB,A great university located along the California coast!,34.416929,-119.848946,https://en.wikipedia.org/wiki/University_of_California,http://admissions.sa.ucsb.edu/images/default-source/rotatingbannerimages/campus-aerial.png?sfvrsn=6a4120cc_2
Buckingham Palace,Buckingham Palace is the London residence and administrative headquarters of the monarchy of the United Kingdom,51.501476,-0.140634,https://en.wikipedia.org/wiki/Buckingham_Palace,https://upload.wikimedia.org/wikipedia/commons/thumb/1/13/Buckingham_Palace_from_gardens%2C_London%2C_UK_-_Diliff_%28cropped%29.jpg/1920px-Buckingham_Palace_from_gardens%2C_London%2C_UK_-_Diliff_%28cropped%29.jpg
Staples Center,"Staples Center (officially stylized as STAPLES Center) is a multi-purpose arena in Downtown Los Angeles. Adjacent to the L.A. Live development, it is located next to the Los Angeles Convention Center complex along Figueroa Street. The arena opened on October 17, 1999.",34.043006,-118.26736,https://en.wikipedia.org/wiki/Staples_Center,https://upload.wikimedia.org/wikipedia/commons/2/24/Staples_Center_2012.jpg
Eiffel Tower,"The Eiffel Tower is a wrought-iron lattice tower on the Champ de Mars in Paris, France. It is named after the engineer Gustave Eiffel, whose company designed and built the tower.",48.858093,2.294694,https://en.wikipedia.org/wiki/Eiffel_Tower,https://imagesvc.meredithcorp.io/v3/mm/image?url=https%3A%2F%2Fstatic.onecms.io%2Fwp-content%2Fuploads%2Fsites%2F28%2F2017%2F02%2Feiffel-tower-paris-france-EIFFEL0217.jpg&q=85
Akihabara,"Akihabara  is a common name for the area around Akihabara Station in the Chiyoda ward of Tokyo, Japan. Administratively, the area called Akihabara mainly belongs to the Sotokanda and Kanda-Sakumachō districts in Chiyoda. There exists an administrative district called Akihabara in the Taitō ward further north of Akihabara Station, but it is not the place people generally refer to as Akihabara.",35.7022,139.7749,https://en.wikipedia.org/wiki/Akihabara,https://upload.wikimedia.org/wikipedia/commons/b/b7/Akhibara_Crossing_%2839878694470%29.jpg
Beijing,"Beijing is the capital of the People's Republic of China. It is the world's most populous capital city, with over 21 million residents, located in North China, is governed as a municipality under the direct administration of the central government with 16 urban, suburban, and rural districts.",39.916668,116.383331,https://en.wikipedia.org/wiki/Beijing,https://www.tomtom.com/en_gb/traffic-index/static/bfa2e45a16cdf21ed00afc1f368640a2/a41d1/city_beijing.jpg